{
  "generated_at": "2026-10-17T11:35:36.028402+00:00",
  "game_name": "minimal-phaser4-game",
  "overall_status": "WARNING",
  "release_tier_achieved": "BETA",
  "hard_blockers": [
    {
      "id": "RB-01",
      "name": "Build & Compilation Failure",
      "status": "PASS",
      "evidence": "Build command declared: 'npm run build'"
    },
    {
      "id": "RB-02",
      "name": "Unhandled Runtime Exceptions",
      "status": "PASS",
      "evidence": "3 scenes detected with Boot/Preload hierarchy"
    },
    {
      "id": "RB-03",
      "name": "Broken Core Gameplay Loop",
      "status": "PASS",
      "evidence": "Gameplay scene present in scene graph"
    },
    {
      "id": "RB-04",
      "name": "Unplayable Touch Controls",
      "status": "PASS",
      "evidence": "Touch control configured: virtual_joystick"
    },
    {
      "id": "RB-05",
      "name": "Missing Asset 404s",
      "status": "PASS",
      "evidence": "4 assets cataloged, 2 defects detected"
    },
    {
      "id": "RB-06",
      "name": "Save / Progress Data Loss",
      "status": "PASS",
      "evidence": "Persistence strategy: 'local_storage'"
    },
    {
      "id": "RB-07",
      "name": "Leaked Secrets in Bundle",
      "status": "PASS",
      "evidence": "No high-entropy API secrets detected in client bundle"
    },
    {
      "id": "RB-08",
      "name": "Critical FPS Degradation",
      "status": "PASS",
      "evidence": "Target FPS configured to 60"
    }
  ],
  "dimension_scores": {
    "fun_core_loop": {
      "score": 7.5,
      "notes": "Scene graph depth: 3 scenes"
    },
    "mobile_usability": {
      "score": 8.0,
      "notes": "Touch type: virtual_joystick, safe area active"
    },
    "game_feel_juice": {
      "score": 5.5,
      "notes": "Basic impact mechanics and particle feedback present"
    },
    "art_cohesion": {
      "score": 6.0,
      "notes": "4 textures, 2 detected defects"
    },
    "audio_feedback": {
      "score": 3.0,
      "notes": "0 audio files present in catalog"
    },
    "technical_stability": {
      "score": 8.0,
      "notes": "Persistence: local_storage"
    },
    "load_performance": {
      "score": 8.5,
      "notes": "Catalog asset payload: 0.00 MB"
    },
    "release_readiness": {
      "score": 7.0,
      "notes": "Build command: npm run build"
    }
  },
  "average_score": 6.69,
  "lowest_dimension": "audio_feedback",
  "findings": [
    {
      "severity": "medium",
      "category": "art_pipeline",
      "title": "Asset Defects Detected",
      "details": "2 defects detected (NPOT or irregular sizing)",
      "suggested_action": "Run playbook 'playbooks/art-pipeline/sprite-sheet-and-animation-qa.md'"
    }
  ],
  "recommended_next_step": "Improve lowest dimension 'audio_feedback' (current score: 3.0)"
}